{
  "idea_id": "idea_20260910_195613_8f3b1a",
  "created_at": "2026-09-10T19:56:13.480101+00:00",
  "source_type": "github_commit",
  "title": "Optimizing DMA buffer contention on STM32H7 (commit 8f3b1a2)",
  "raw_notes": "Observed 24% lower memory bus contention when implementing ping-pong buffers for camera feed during continuous MobileNetV2 inference.\nCommit message: <untrusted_source_data>optimize DMA ping-pong buffer on STM32H7, cut bus contention by 24%</untrusted_source_data>",
  "pillar_affinity": "pillar_embedded_firmware",
  "technical_artifacts_available": [
    "logic_analyzer_trace",
    "dma_manager.c_diff"
  ],
  "project_id": "proj_tinyml_edge_vision"
}