{
  "idea_id": "idea_shallow_reflection",
  "created_at": "2026-09-12T13:13:25.338772+00:00",
  "source_type": "lab_note",
  "title": "Thinking about microcontrollers vs FPGAs",
  "raw_notes": "Had some general thoughts on when to use an FPGA vs an MCU for robotics.",
  "pillar_affinity": "pillar_embedded_firmware",
  "technical_artifacts_available": [],
  "project_id": null
}